{
  "schemaVersion": 1,
  "version": 15,
  "generatedAt": "2026-08-28T21:16:00.2292721\u002B00:00",
  "links": [
    {
      "id": "9116f2aa-8d5c-47df-9fe5-f0509c3c9be5",
      "name": "yemen tv",
      "url": "https://live.yementv.tv/c79810a8-85f6-414f-980b-0ae14ad5228d.html",
      "type": "AUTO",
      "resolvedType": "WEB_PAGE",
      "image": null,
      "category": null,
      "notes": null,
      "country": null,
      "enabled": true,
      "order": 10,
      "startAt": null,
      "expiresAt": null,
      "adBlockEnabled": true
    },
    {
      "id": "749f4c1d-f36c-4c36-bd5b-51ba9e455220",
      "name": "hadhramaut",
      "url": "https://hadhramaut.tv/",
      "type": "AUTO",
      "resolvedType": "WEB_PAGE",
      "image": null,
      "category": null,
      "notes": null,
      "country": null,
      "enabled": true,
      "order": 20,
      "startAt": null,
      "expiresAt": null,
      "adBlockEnabled": true
    },
    {
      "id": "a09e6296-fc35-486e-8300-68a5ff5e06ff",
      "name": "yemen shabab",
      "url": "https://yemenshabab.org/live",
      "type": "AUTO",
      "resolvedType": null,
      "image": null,
      "category": null,
      "notes": null,
      "country": null,
      "enabled": true,
      "order": 30,
      "startAt": null,
      "expiresAt": null,
      "adBlockEnabled": true
    },
    {
      "id": "bb72ba32-54f2-41a8-ac5b-67af6af0e1fc",
      "name": "\u0631\u0627\u0628\u0637 \u062C\u062F\u064A\u062F \u0645\u0628\u0627\u0631\u0647",
      "url": "https://ka.yallacuop.xyz/sport-1/",
      "type": "DIRECT_STREAM",
      "resolvedType": null,
      "image": null,
      "category": null,
      "notes": null,
      "country": null,
      "enabled": true,
      "order": 40,
      "startAt": null,
      "expiresAt": null,
      "adBlockEnabled": true
    },
    {
      "id": "fe5a5757-bcea-4e6b-b5a7-c85eef7b08e0",
      "name": "\u0643\u0648\u0631\u0647",
      "url": "https://www.yalla-shooot.sbs/",
      "type": "AUTO",
      "resolvedType": "WEB_PAGE",
      "image": null,
      "category": null,
      "notes": null,
      "country": null,
      "enabled": true,
      "order": 50,
      "startAt": null,
      "expiresAt": null,
      "adBlockEnabled": true
    }
  ]
}
